No.,Time,Source,Destination,Protocol,Length,Info
921,23.385752,192.168.0.98,202.165.107.57,TCP,66,51516  >  80 [SYN] Seq=0 Win=64240 Len=0 MSS=1460 WS=256 SACK_PERM
922,23.385892,192.168.0.98,202.165.107.57,TCP,66,51517  >  80 [SYN] Seq=0 Win=64240 Len=0 MSS=1460 WS=256 SACK_PERM
936,23.634806,202.165.107.57,192.168.0.98,TCP,66,"80  >  51516 [SYN, ACK] Seq=0 Ack=1 Win=29200 Len=0 MSS=1446 SACK_PERM WS=128"
937,23.634959,192.168.0.98,202.165.107.57,TCP,54,51516  >  80 [ACK] Seq=1 Ack=1 Win=131584 Len=0
938,23.635097,202.165.107.57,192.168.0.98,TCP,66,"80  >  51517 [SYN, ACK] Seq=0 Ack=1 Win=29200 Len=0 MSS=1446 SACK_PERM WS=128"
940,23.635214,192.168.0.98,202.165.107.57,TCP,54,51517  >  80 [ACK] Seq=1 Ack=1 Win=131584 Len=0
953,23.641567,192.168.0.98,202.165.107.57,HTTP,480,GET / HTTP/1.1 
965,23.882358,202.165.107.57,192.168.0.98,TCP,54,80  >  51516 [ACK] Seq=1 Ack=427 Win=30336 Len=0
966,23.885205,202.165.107.57,192.168.0.98,HTTP,580,HTTP/1.1 301 Redirect  (text/html)
975,23.928533,192.168.0.98,202.165.107.57,TCP,54,51516  >  80 [ACK] Seq=427 Ack=527 Win=130816 Len=0
1292,27.778699,192.168.0.98,87.248.100.208,TCP,66,51523  >  80 [SYN] Seq=0 Win=64240 Len=0 MSS=1460 WS=256 SACK_PERM
1296,27.794682,87.248.100.208,192.168.0.98,TCP,66,"80  >  51523 [SYN, ACK] Seq=0 Ack=1 Win=29200 Len=0 MSS=1446 SACK_PERM WS=128"
1297,27.79474,192.168.0.98,87.248.100.208,TCP,54,51523  >  80 [ACK] Seq=1 Ack=1 Win=131584 Len=0
5316,34.218082,202.165.107.57,192.168.0.98,TCP,54,"80  >  51516 [FIN, ACK] Seq=527 Ack=427 Win=30336 Len=0"
5317,34.218241,192.168.0.98,202.165.107.57,TCP,54,51516  >  80 [ACK] Seq=427 Ack=528 Win=130816 Len=0
5494,37.213025,192.168.0.98,202.165.107.57,TCP,54,"51516  >  80 [FIN, ACK] Seq=427 Ack=528 Win=130816 Len=0"
5541,37.456314,202.165.107.57,192.168.0.98,TCP,54,80  >  51516 [RST] Seq=528 Win=0 Len=0
8587,68.648709,192.168.0.98,202.165.107.57,TCP,55,[TCP Keep-Alive] 51517  >  80 [ACK] Seq=0 Ack=1 Win=131584 Len=1
8589,68.890146,202.165.107.57,192.168.0.98,TCP,54,[TCP Window Update] 80  >  51517 [ACK] Seq=1 Ack=1 Win=29184 Len=0
8807,72.813836,192.168.0.98,87.248.100.208,TCP,55,[TCP Keep-Alive] 51523  >  80 [ACK] Seq=0 Ack=1 Win=131584 Len=1
8809,72.83041,87.248.100.208,192.168.0.98,TCP,54,[TCP Window Update] 80  >  51523 [ACK] Seq=1 Ack=1 Win=29184 Len=0
